framework,layer,evidence_type,loop_autonomy,reproducibility_level,failure_memory,correlation_control,oos_gate,production_status,primary_metric,current_evidence,next_required_evidence
WQ alpha research skill,alpha_discovery,private_sanitized,autonomous,closed_platform,structured,pretrade_or_prepromotion,weak,research_only,accepted_count_and_spectacular_count,external repository reachable; no private run committed,sanitized private WQ aggregate run
ARA-WQ Alpha Evolution,ara_audit,protocol,assisted,public_full,structured,pretrade_or_prepromotion,frozen_strong,protocol_only,reproducibility_and_auditability,ara_artifacts/wq_alpha_evolution and docs/reports/wq_alpha_evolution_comparison_plan.md,public proxy factor-mining run
FunctionEvolve-style proxy,alpha_discovery,public_proxy,assisted,public_full,structured,pretrade_or_prepromotion,frozen_strong,research_only,public AST factor promotion count,experiments/wq_functionevolve_proxy/functionevolve_proxy_summary.csv,vectorized full-universe run and Lingxi blending ablation
SIA-style harness,hybrid,protocol,autonomous,public_full,structured,pretrade_or_prepromotion,frozen_strong,protocol_only,research-loop improvement rate,docs/reports/functionevolve_lingxi_feedback.md,implement Meta/Target/Feedback loop around Lingxi experiments
Godel-Agent-style self-improvement,hybrid,protocol,autonomous,partial,structured,pretrade_or_prepromotion,frozen_strong,protocol_only,self-modification acceptance rate,docs/reports/functionevolve_lingxi_feedback.md,constrain self-modifications with ARA trace and frozen OOS gates
CASE-Lingxi,strategy_routing,local_backtest,assisted,public_full,structured,pretrade_or_prepromotion,frozen_strong,production,Lingxi Adaptive Suite promotion status,docs/reports/case_lingxi_completion_audit.md and scripts/validate_case_lingxi_bundle.py,future WQ-style memory ablation
Future Lingxi memory upgrade,hybrid,public_proxy,autonomous,partial,structured,pretrade_or_prepromotion,frozen_strong,research_only,promotion-gate improvement over Lingxi Top5/Top10,planned in ara_artifacts/wq_alpha_evolution/logic/experiments.md,implement frozen OOS ablation script
